{
  "body_id": "uk-state-body-department-for-transport",
  "citation": {
    "as_at": "2025-03-31",
    "dataset": "source-official-dataset-civil-service-statistics-2025",
    "table": "CSS_2025"
  },
  "grade": null,
  "metric": "fte",
  "notes": "Departmental GROUP total (includes agencies, which are also held as separate bodies) — do not sum a department with its agencies.",
  "period": "2025",
  "profession": "Internal Audit",
  "record_status": "extracted",
  "source_id": "source-official-dataset-civil-service-statistics-2025",
  "staff_group": "civil_service",
  "staffing_record_id": "staffing-department-for-transport-2025-fte-profession-internal-audit",
  "value": 20
}
