{
  "body_id": "uk-state-body-charity-commission",
  "citation": {
    "as_at": "2025-03-31",
    "dataset": "source-official-dataset-civil-service-statistics-2025",
    "table": "CSS_2025"
  },
  "grade": "eo",
  "metric": "fte",
  "notes": null,
  "period": "2025",
  "profession": null,
  "record_status": "extracted",
  "source_id": "source-official-dataset-civil-service-statistics-2025",
  "staff_group": "civil_service",
  "staffing_record_id": "staffing-charity-commission-2025-fte-grade-eo",
  "value": 240
}
