{
  "body_id": "uk-state-body-hm-treasury",
  "citation": {
    "as_at": "2025-03-31",
    "dataset": "source-official-dataset-civil-service-statistics-2025",
    "table": "CSS_2025"
  },
  "grade": null,
  "metric": "headcount",
  "notes": "Departmental GROUP total (includes agencies, which are also held as separate bodies) — do not sum a department with its agencies.",
  "period": "2025",
  "profession": "Economics",
  "record_status": "extracted",
  "source_id": "source-official-dataset-civil-service-statistics-2025",
  "staff_group": "civil_service",
  "staffing_record_id": "staffing-hm-treasury-2025-headcount-profession-economics",
  "value": 230
}
