{
  "body_id": "uk-state-body-department-of-health-and-social-care",
  "citation": {
    "as_at": "2025-03-31",
    "dataset": "source-official-dataset-civil-service-statistics-2025",
    "table": "CSS_2025"
  },
  "grade": "seo_heo",
  "metric": "fte",
  "notes": "Departmental GROUP total (includes agencies, which are also held as separate bodies) — do not sum a department with its agencies.",
  "period": "2025",
  "profession": null,
  "record_status": "extracted",
  "source_id": "source-official-dataset-civil-service-statistics-2025",
  "staff_group": "civil_service",
  "staffing_record_id": "staffing-department-of-health-and-social-care-2025-fte-grade-seo_heo",
  "value": 4335
}
