{
  "body_id": "uk-state-body-the-water-services-regulation-authority",
  "citation": {
    "as_at": "2025-03-31",
    "dataset": "source-official-dataset-civil-service-statistics-2025",
    "table": "CSS_2025"
  },
  "grade": "aa_ao",
  "metric": "headcount",
  "notes": null,
  "period": "2025",
  "profession": null,
  "record_status": "extracted",
  "source_id": "source-official-dataset-civil-service-statistics-2025",
  "staff_group": "civil_service",
  "staffing_record_id": "staffing-the-water-services-regulation-authority-2025-headcount-grade-aa_ao",
  "value": 10
}
