{
  "body_id": "uk-state-body-veterinary-medicines-directorate",
  "citation": {
    "as_at": "2025-03-31",
    "dataset": "source-official-dataset-civil-service-statistics-2025",
    "table": "CSS_2025"
  },
  "grade": null,
  "metric": "fte",
  "notes": null,
  "period": "2025",
  "profession": "Digital and Data",
  "record_status": "extracted",
  "source_id": "source-official-dataset-civil-service-statistics-2025",
  "staff_group": "civil_service",
  "staffing_record_id": "staffing-veterinary-medicines-directorate-2025-fte-profession-digital-and-data",
  "value": 5
}
