{
  "body_id": "uk-state-body-crown-prosecution-service",
  "citation": {
    "as_at": "2025-03-31",
    "dataset": "source-official-dataset-civil-service-statistics-2025",
    "table": "CSS_2025"
  },
  "grade": null,
  "metric": "headcount",
  "notes": null,
  "period": "2025",
  "profession": "Commercial",
  "record_status": "extracted",
  "source_id": "source-official-dataset-civil-service-statistics-2025",
  "staff_group": "civil_service",
  "staffing_record_id": "staffing-crown-prosecution-service-2025-headcount-profession-commercial",
  "value": 40
}
