{
  "body_id": "uk-state-body-uk-debt-management-office",
  "citation": {
    "as_at": "2025-03-31",
    "dataset": "source-official-dataset-civil-service-statistics-2025",
    "table": "CSS_2025"
  },
  "grade": null,
  "metric": "headcount",
  "notes": null,
  "period": "2025",
  "profession": "Economics",
  "record_status": "extracted",
  "source_id": "source-official-dataset-civil-service-statistics-2025",
  "staff_group": "civil_service",
  "staffing_record_id": "staffing-uk-debt-management-office-2025-headcount-profession-economics",
  "value": 10
}
