{
  "body_id": "uk-state-body-uk-space-agency",
  "citation": {
    "as_at": "2025-03-31",
    "dataset": "source-official-dataset-civil-service-statistics-2025",
    "table": "CSS_2025"
  },
  "grade": null,
  "metric": "fte",
  "notes": null,
  "period": "2025",
  "profession": "Operational Delivery",
  "record_status": "extracted",
  "source_id": "source-official-dataset-civil-service-statistics-2025",
  "staff_group": "civil_service",
  "staffing_record_id": "staffing-uk-space-agency-2025-fte-profession-operational-delivery",
  "value": 35
}
