{
  "body_id": "uk-state-body-intellectual-property-office",
  "citation": {
    "as_at": "2025-03-31",
    "dataset": "source-official-dataset-civil-service-statistics-2025",
    "table": "CSS_2025"
  },
  "grade": null,
  "metric": "fte",
  "notes": null,
  "period": "2025",
  "profession": "Finance",
  "record_status": "extracted",
  "source_id": "source-official-dataset-civil-service-statistics-2025",
  "staff_group": "civil_service",
  "staffing_record_id": "staffing-intellectual-property-office-2025-fte-profession-finance",
  "value": 30
}
